{
  "codex": {
    "present": true,
    "source_db": "/home/harry/ssd1/projects/cfd_agentic_benchmark/cfd_solver_benchmark_workspace_template/workspace/codex/dsv4_flash/03/.sessions/codex/state_5.sqlite",
    "sessions_root": "/home/harry/ssd1/projects/cfd_agentic_benchmark/cfd_solver_benchmark_workspace_template/workspace/codex/dsv4_flash/03/.sessions/codex/sessions",
    "thread_count": 1,
    "subagent_count": 0,
    "root_count": 1,
    "roots": [
      {
        "thread_id": "019fc2bb-3f78-7202-a0de-cfa25e061493",
        "model": "deepseek/deepseek-v4-flash",
        "thread_count": 1,
        "started_at": "2026-08-02T13:48:57.708000+00:00",
        "ended_at": "2026-08-03T15:03:35.090000+00:00",
        "rollout_bytes": 12312285
      }
    ],
    "rollout_bytes_total": 12312285,
    "missing_rollouts": [],
    "source": "project"
  },
  "opencode": {
    "present": false,
    "session_count": 0
  },
  "analysis": {
    "bucket_seconds": 1800,
    "idle_gap_seconds": 600,
    "window": {
      "start": "2026-08-02T13:48:57.708000+00:00",
      "end": "2026-08-03T15:03:35.090000+00:00"
    },
    "idle_exclusion": {
      "method": "merged timeline over main thread/session and all subagents; gaps with no events anywhere exceed the threshold and are excluded",
      "gap_count": 0,
      "gaps": [],
      "idle_seconds_total": 0
    },
    "permission_waits": {
      "method": "heuristic",
      "explicit_approval_events_found": false,
      "ask_tool_events_found": 0,
      "candidate_gaps": [],
      "candidate_count": 0,
      "policy_observed": [
        "never",
        "reviewer=user"
      ],
      "limitations": [
        "codex rollouts contain no explicit approval-request/response event types (verified by scanning all local sessions); permission-blocked idle cannot be distinguished from user-away time with certainty",
        "candidates are gaps > idle threshold between a tool/turn boundary and a user message / new turn in approval-aware threads; expect false positives when the user stepped away"
      ]
    },
    "buckets": [
      {
        "bucket_index": 0,
        "start": "2026-08-02T13:48:57.708000+00:00",
        "end": "2026-08-02T14:18:57.708000+00:00",
        "active_seconds": 1800.0,
        "idle_seconds": 0.0,
        "active": true,
        "tokens": {
          "input": 17594138,
          "cached_input": 17318016,
          "non_cached_input": 276122,
          "output": 161243,
          "reasoning_output": 84682,
          "total": 17755381
        },
        "cache": {
          "cached_tokens": 17318016,
          "input_tokens": 17594138,
          "hit_ratio": 0.9843
        },
        "tools": {
          "total": 131,
          "by_tool": {
            "exec_command": 85,
            "apply_patch": 38,
            "write_stdin": 7,
            "update_plan": 1
          },
          "by_category": {
            "shell": 92,
            "editing": 38,
            "planning": 1
          }
        },
        "turns": {
          "thread_goal_updated": 1,
          "task_started": 1,
          "agent_message": 23
        },
        "active_entities": [
          "019fc2bb-3f78-7202-a0de-cfa25e061493"
        ],
        "active_entity_count": 1
      },
      {
        "bucket_index": 1,
        "start": "2026-08-02T14:18:57.708000+00:00",
        "end": "2026-08-02T14:48:57.708000+00:00",
        "active_seconds": 1800.0,
        "idle_seconds": 0.0,
        "active": true,
        "tokens": {
          "input": 20932697,
          "cached_input": 20843520,
          "non_cached_input": 89177,
          "output": 75187,
          "reasoning_output": 53331,
          "total": 21007884
        },
        "cache": {
          "cached_tokens": 20843520,
          "input_tokens": 20932697,
          "hit_ratio": 0.9957
        },
        "tools": {
          "total": 77,
          "by_tool": {
            "exec_command": 41,
            "apply_patch": 25,
            "write_stdin": 9,
            "view_image": 2
          },
          "by_category": {
            "shell": 50,
            "editing": 25,
            "files": 2
          }
        },
        "turns": {
          "agent_message": 13
        },
        "active_entities": [
          "019fc2bb-3f78-7202-a0de-cfa25e061493"
        ],
        "active_entity_count": 1
      },
      {
        "bucket_index": 2,
        "start": "2026-08-02T14:48:57.708000+00:00",
        "end": "2026-08-02T15:18:57.708000+00:00",
        "active_seconds": 1800.0,
        "idle_seconds": 0.0,
        "active": true,
        "tokens": {
          "input": 25614710,
          "cached_input": 25586560,
          "non_cached_input": 28150,
          "output": 66032,
          "reasoning_output": 46437,
          "total": 25680742
        },
        "cache": {
          "cached_tokens": 25586560,
          "input_tokens": 25614710,
          "hit_ratio": 0.9989
        },
        "tools": {
          "total": 71,
          "by_tool": {
            "exec_command": 30,
            "apply_patch": 21,
            "write_stdin": 20
          },
          "by_category": {
            "shell": 50,
            "editing": 21
          }
        },
        "turns": {
          "agent_message": 8
        },
        "active_entities": [
          "019fc2bb-3f78-7202-a0de-cfa25e061493"
        ],
        "active_entity_count": 1
      },
      {
        "bucket_index": 3,
        "start": "2026-08-02T15:18:57.708000+00:00",
        "end": "2026-08-02T15:48:57.708000+00:00",
        "active_seconds": 1800.0,
        "idle_seconds": 0.0,
        "active": true,
        "tokens": {
          "input": 14204522,
          "cached_input": 14197888,
          "non_cached_input": 6634,
          "output": 38828,
          "reasoning_output": 28740,
          "total": 14243350
        },
        "cache": {
          "cached_tokens": 14197888,
          "input_tokens": 14204522,
          "hit_ratio": 0.9995
        },
        "tools": {
          "total": 33,
          "by_tool": {
            "exec_command": 13,
            "apply_patch": 11,
            "write_stdin": 9
          },
          "by_category": {
            "shell": 22,
            "editing": 11
          }
        },
        "turns": {
          "agent_message": 8
        },
        "active_entities": [
          "019fc2bb-3f78-7202-a0de-cfa25e061493"
        ],
        "active_entity_count": 1
      },
      {
        "bucket_index": 4,
        "start": "2026-08-02T15:48:57.708000+00:00",
        "end": "2026-08-02T16:18:57.708000+00:00",
        "active_seconds": 1800.0,
        "idle_seconds": 0.0,
        "active": true,
        "tokens": {
          "input": 11168340,
          "cached_input": 10958592,
          "non_cached_input": 209748,
          "output": 19431,
          "reasoning_output": 12576,
          "total": 11187771
        },
        "cache": {
          "cached_tokens": 10958592,
          "input_tokens": 11168340,
          "hit_ratio": 0.9812
        },
        "tools": {
          "total": 24,
          "by_tool": {
            "write_stdin": 8,
            "apply_patch": 8,
            "exec_command": 8
          },
          "by_category": {
            "shell": 16,
            "editing": 8
          }
        },
        "turns": {
          "agent_message": 4
        },
        "active_entities": [
          "019fc2bb-3f78-7202-a0de-cfa25e061493"
        ],
        "active_entity_count": 1
      },
      {
        "bucket_index": 5,
        "start": "2026-08-02T16:18:57.708000+00:00",
        "end": "2026-08-02T16:48:57.708000+00:00",
        "active_seconds": 1800.0,
        "idle_seconds": 0.0,
        "active": true,
        "tokens": {
          "input": 11571477,
          "cached_input": 11550976,
          "non_cached_input": 20501,
          "output": 12419,
          "reasoning_output": 7426,
          "total": 11583896
        },
        "cache": {
          "cached_tokens": 11550976,
          "input_tokens": 11571477,
          "hit_ratio": 0.9982
        },
        "tools": {
          "total": 24,
          "by_tool": {
            "exec_command": 12,
            "write_stdin": 8,
            "apply_patch": 4
          },
          "by_category": {
            "shell": 20,
            "editing": 4
          }
        },
        "turns": {
          "agent_message": 3
        },
        "active_entities": [
          "019fc2bb-3f78-7202-a0de-cfa25e061493"
        ],
        "active_entity_count": 1
      },
      {
        "bucket_index": 6,
        "start": "2026-08-02T16:48:57.708000+00:00",
        "end": "2026-08-02T17:18:57.708000+00:00",
        "active_seconds": 1800.0,
        "idle_seconds": 0.0,
        "active": true,
        "tokens": {
          "input": 8057429,
          "cached_input": 7990784,
          "non_cached_input": 66645,
          "output": 80787,
          "reasoning_output": 58741,
          "total": 8138216
        },
        "cache": {
          "cached_tokens": 7990784,
          "input_tokens": 8057429,
          "hit_ratio": 0.9917
        },
        "tools": {
          "total": 75,
          "by_tool": {
            "exec_command": 63,
            "write_stdin": 6,
            "apply_patch": 5,
            "view_image": 1
          },
          "by_category": {
            "shell": 69,
            "editing": 5,
            "files": 1
          }
        },
        "turns": {
          "agent_message": 27,
          "context_compacted": 1
        },
        "active_entities": [
          "019fc2bb-3f78-7202-a0de-cfa25e061493"
        ],
        "active_entity_count": 1
      },
      {
        "bucket_index": 7,
        "start": "2026-08-02T17:18:57.708000+00:00",
        "end": "2026-08-02T17:48:57.708000+00:00",
        "active_seconds": 1800.0,
        "idle_seconds": 0.0,
        "active": true,
        "tokens": {
          "input": 9296375,
          "cached_input": 9107456,
          "non_cached_input": 188919,